<?xml version="1.0" encoding="UTF-8"?>
<!--
  ~ Copyright (C) 2001-2016 Food and Agriculture Organization of the
  ~ United Nations (FAO-UN), United Nations World Food Programme (WFP)
  ~ and United Nations Environment Programme (UNEP)
  ~
  ~ This program is free software; you can redistribute it and/or modify
  ~ it under the terms of the GNU General Public License as published by
  ~ the Free Software Foundation; either version 2 of the License, or (at
  ~ your option) any later version.
  ~
  ~ This program is distributed in the hope that it will be useful, but
  ~ WITHOUT ANY WARRANTY; without even the implied warranty of
  ~ MERCHANTABILITY or FITNESS FOR A PARTICULAR PURPOSE. See the GNU
  ~ General Public License for more details.
  ~
  ~ You should have received a copy of the GNU General Public License
  ~ along with this program; if not, write to the Free Software
  ~ Foundation, Inc., 51 Franklin St, Fifth Floor, Boston, MA 02110-1301, USA
  ~
  ~ Contact: Jeroen Ticheler - FAO - Viale delle Terme di Caracalla 2,
  ~ Rome - Italy. email: geonetwork@osgeo.org
  -->

<labels xmlns:xsi="http://www.w3.org/2001/XMLSchema-instance"
        xmlns:gco="http://www.isotc211.org/2005/gco"
        xmlns:gmd="http://www.isotc211.org/2005/gmd"
        xmlns:srv="http://www.isotc211.org/2005/srv" xmlns:gml="http://www.opengis.net/gml"
        xmlns:gts="http://www.isotc211.org/2005/gts" xmlns:gmx="http://www.isotc211.org/2005/gmx"
        xsi:noNamespaceSchemaLocation="../../../../../../../schema-labels.xsd">

  <element name="gmd:MD_ScopeCode">
    <label>Scope code</label>
    <description>Class of information to which the referencing entity applies</description>
  </element>
  <element name="code" id="207.0" context="gmd:MD_Identifier">
    <label>Code</label>
    <description>Alphanumeric value identifying an instance in the namespace</description>
    <help>alphanumeric value identifying an instance in the namespace</help>
  </element>
  <element name="code">
    <label>System code</label>
    <description>Code. i.e. EPSG code.</description>
  </element>
  <element name="code" id="547.0" context="gmd:MD_CodeValue">
    <label>Code</label>
    <description>Value code</description>
    <help>Value code (i.e. numeric)</help>
  </element>
  <element name="codeSpace" id="208.1">
    <label>Reference Authority</label>
    <description>Authority responsible for codification. i.e. EPSG</description>
  </element>
  <element name="gco:Date" id="364.0" context="gmd:CI_Citation">
    <label>Edition Date</label>
    <description>Date of the edition</description>
  </element>
  <element name="gco:Date" id="393.0">
    <label>Date</label>
    <description>Formatted as 2007-09-12 (YYYY-MM-DD)</description>
    <help>reference date and event used to describe it</help>
    <_condition>Use obligation/condition from referencing object</_condition>
  </element>
  <element name="gco:DateTime" id="64.0" context="gmd:MD_Usage">
    <description>Formatted as 2007-09-12T15:00:00 (YYYY-MM-DDTHH:mm:ss)</description>
    <label>Usage Date / Time</label>
    <help>date and time of the first use or range of uses of the resource and/or resource
      series
    </help>
  </element>
  <element name="gco:DateTime" id="300.0" context="gmd:MD_StandardOrderProcess">
    <description>Formatted as 2007-09-12T15:00:00 (YYYY-MM-DDTHH:mm:ss)</description>
    <label>Planned Available Date / Time</label>
    <help>date and time when theresource will be available</help>
  </element>
  <element name="gco:DateTime">
    <label>Date and time</label>
    <description>Date and time or range of date and time on or over which the process step occurred
      (YYYY-MM-DDThh:mm:ss)
    </description>
  </element>
  <element name="gco:Measure" id="100.0" context="gmd:DQ_Element">
    <label>Name of Measure</label>
    <description>Name of the test applied to the data</description>
  </element>
  <element name="gco:Measure" id="357.0" context="gmd:EX_VerticalExtent">
    <label>Unit of Measure</label>
    <description>Vertical units used for vertical extent information Examples: metres, feet,
      millimetres, hectopascals
    </description>
    <_condition>M</_condition>
  </element>
  <element name="gmd:CI_Address" id="380.0">
    <label>Address</label>
    <description>Location of the responsible individual or organization</description>
    <_condition>Use obligation/condition from referencing object</_condition>
  </element>
  <element name="gmd:CI_Citation" id="359.0">
    <label>Citation</label>
    <description>Standardised resource reference</description>
    <_condition>Use obligation/condition from referencing object</_condition>
  </element>
  <element name="gmd:CI_Contact" id="387.0">
    <label>Contact</label>
    <description>Information required to enable contact with the responsible person and/or
      organization
    </description>
    <_condition>Use obligation/condition from referencing object</_condition>
  </element>
  <element name="gmd:CI_Date" id="393.0">
    <label>Date</label>
    <description>Reference date and event used to describe it (YYYY-MM-DD)</description>
    <_condition>Use obligation/condition from referencing object</_condition>
  </element>
  <element name="gmd:CI_DateTypeCode">
    <label>Date type code</label>
    <description/>
  </element>
  <element name="gmd:CI_OnLineFunctionCode">
    <label>OnLine function code</label>
    <description/>
  </element>
  <element name="gmd:CI_PresentationFormCode">
    <label>Presentatiewijze code</label>
    <description/>
  </element>
  <element name="gmd:CI_OnlineResource" id="396.0">
    <label>OnLine resource</label>
    <description>Information about on-line sources from which the dataset, specification, or
      community profile name and extended metadata elements can be obtained
    </description>
    <_condition>Use obligation/condition from referencing object</_condition>
  </element>
  <element name="gmd:CI_ResponsibleParty" id="374.0">
    <label>Responsible party</label>
    <description>Identification of, and means of communication with, person(s) and organizations
      associated with the dataset
    </description>
    <_condition>Use obligation/condition from referencing object</_condition>
  </element>
  <element name="gmd:CI_Series" id="403.0">
    <label>Series</label>
    <description>Information about the series, or aggregate dataset, to which a dataset
      belongs
    </description>
    <_condition>Use obligation/condition from referencing object</_condition>
  </element>
  <element name="gmd:CI_Telephone" id="407.0">
    <label>Telephone</label>
    <description>Telephone numbers for contacting the responsible individual or
      organization
    </description>
    <_condition>Use obligation/condition from referencing object</_condition>
  </element>
  <element name="gmd:DQ_AbsoluteExternalPositionalAccuracy" id="117.0">
    <label>Absolute external positional accuracy</label>
    <description>Closeness of reported coordinate values to values accepted as or being
      true
    </description>
  </element>
  <element name="gmd:DQ_AccuracyOfATimeMeasurement" id="121.0">
    <label>Accuracy of time measurement</label>
    <description>Correctness of the temporal references of an item (reporting of error in time
      measurement)
    </description>
  </element>
  <element name="gmd:DQ_CompletenessCommission" id="109.0">
    <label>Completeness commission</label>
    <description>Excess data present in the dataset, as described by the scope</description>
  </element>
  <element name="gmd:DQ_CompletenessOmission" id="110.0">
    <label>Completeness omission</label>
    <description>Data absent from the dataset, as described by the scope</description>
  </element>
  <element name="gmd:DQ_ConceptualConsistency" id="112.0">
    <label>Conceptual consistency</label>
    <description>Adherence to rules of the conceptual schema</description>
  </element>
  <element name="gmd:DQ_ConformanceResult" id="129.0">
    <label>Conformance result</label>
    <description>Information about the outcome of evaluating the obtained value (or set of
      values) against a specified acceptable conformance quality level
    </description>
  </element>
  <element name="gmd:DQ_DataQuality" id="78.0">
    <label>Data quality</label>
    <description>Quality information for the data specified by a data quality
      scope
    </description>
  </element>
  <element name="gmd:DQ_DomainConsistency" id="113.0">
    <label>Domain consistency</label>
    <description>Adherence of values to the value domains</description>
  </element>
  <element name="gmd:DQ_EvaluationMethodTypeCode">
    <label>Evaluation method type code</label>
    <description>type of method for evaluating an identified data quality
      measure
    </description>
  </element>
  <element name="gmd:DQ_FormatConsistency" id="114.0">
    <label>Format consistency</label>
    <description>Degree to which data is stored in accordance with the physical structure of the
      dataset, as described by the scope
    </description>
  </element>
  <element name="gmd:DQ_GriddedDataPositionalAccuracy" id="118.0">
    <label>Gridded data positional accuracy</label>
    <description>Closeness of gridded data position values to values accepted as or being
      true
    </description>
  </element>
  <element name="gmd:DQ_NonQuantitativeAttributeAccuracy" id="126.0">
    <label>Non quantitative attribute accuracy</label>
    <description>Correctness of non-quantitative attributes</description>
  </element>
  <element name="gmd:DQ_QuantitativeAttributeAccuracy" id="127.0">
    <label>Quantitative attribute accuracy</label>
    <description>Accuracy of quantitative attributes</description>
  </element>
  <element name="gmd:DQ_QuantitativeResult" id="133.0">
    <label>Quantitative result</label>
    <description>The values or information about the value(s) (or set of values) obtained from
      applying a data quality measure